<?xml version="1.0" encoding="utf-8"?>
<!DOCTYPE kanjiList SYSTEM "kanjiList.dtd">
<kanjiList>
	<name>Genki 2, Lesson 18 Vocabulary</name>
	<listItem>
		<kanji>あと</kanji>
		<kana>あと</kana>
		<english>the rest</english>
	</listItem>
	<listItem>
		<kanji>エアコン</kanji>
		<kana>エアコン</kana>
		<english>air conditioner</english>
	</listItem>
	<listItem>
		<kanji>カーテン</kanji>
		<kana>カーテン</kana>
		<english>curtain</english>
	</listItem>
	<listItem>
		<kanji>クッション</kanji>
		<kana>クッション</kana>
		<english>cushion</english>
	</listItem>
	<listItem>
		<kanji>シャンプー</kanji>
		<kana>シャンプー</kana>
		<english>shampoo</english>
	</listItem>
	<listItem>
		<kanji>醤油</kanji>
		<kana>しょうゆ</kana>
		<english>soy sauce</english>
	</listItem>
	<listItem>
		<kanji>スイッチ</kanji>
		<kana>スイッチ</kana>
		<english>switch</english>
	</listItem>
	<listItem>
		<kanji>スープ</kanji>
		<kana>スープ</kana>
		<english>soup</english>
	</listItem>
	<listItem>
		<kanji>スカート</kanji>
		<kana>スカート</kana>
		<english>skirt</english>
	</listItem>
	<listItem>
		<kanji>外</kanji>
		<kana>そと</kana>
		<english>outside</english>
	</listItem>
	<listItem>
		<kanji>ソファ</kanji>
		<kana>ソファ</kana>
		<english>sofa</english>
	</listItem>
	<listItem>
		<kanji>タオル</kanji>
		<kana>タオル</kana>
		<english>towel</english>
	</listItem>
	<listItem>
		<kanji>日記</kanji>
		<kana>にっき</kana>
		<english>diary</english>
	</listItem>
	<listItem>
		<kanji>バナナ</kanji>
		<kana>バナナ</kana>
		<english>banana</english>
	</listItem>
	<listItem>
		<kanji>ポップコーン</kanji>
		<kana>ポップコーン</kana>
		<english>popcorn</english>
	</listItem>
	<listItem>
		<kanji>虫</kanji>
		<kana>むし</kana>
		<english>insect</english>
	</listItem>
	<listItem>
		<kanji>家賃</kanji>
		<kana>やちん</kana>
		<english>rent</english>
	</listItem>
	<listItem>
		<kanji>夕方</kanji>
		<kana>ゆうがた</kana>
		<english>evening</english>
	</listItem>
	<listItem>
		<kanji>留守番電話</kanji>
		<kana>るすばんでんわ</kana>
		<english>answering machine</english>
	</listItem>
	<listItem>
		<kanji>冷蔵庫</kanji>
		<kana>れいぞうこ</kana>
		<english>refrigerator</english>
	</listItem>
	<listItem>
		<kanji>ろうそく</kanji>
		<kana>ろうそく</kana>
		<english>candle</english>
	</listItem>
	<listItem>
		<kanji>明るい</kanji>
		<kana>あかるい</kana>
		<english>bright</english>
	</listItem>
	<listItem>
		<kanji>気分が悪い</kanji>
		<kana>きぶんがわるい</kana>
		<english>to feel sick</english>
	</listItem>
	<listItem>
		<kanji>暗い</kanji>
		<kana>くらい</kana>
		<english>dark</english>
	</listItem>
	<listItem>
		<kanji>恥ずかしい</kanji>
		<kana>はずかしい</kana>
		<english>embarrassing; to feel embarrassed</english>
	</listItem>
	<listItem>
		<kanji>（～が）開く</kanji>
		<kana>（～が）あく</kana>
		<english>(something) opens</english>
	</listItem>
	<listItem>
		<kanji>（～に）謝る</kanji>
		<kana>（～に）あやまる</kana>
		<english>to apologize (to ~)</english>
	</listItem>
	<listItem>
		<kanji>（～を）押す</kanji>
		<kana>（～を）おす</kana>
		<english>to press; to push</english>
	</listItem>
	<listItem>
		<kanji>（～を）落とす</kanji>
		<kana>（～を）おとす</kana>
		<english>to drop (something)</english>
	</listItem>
	<listItem>
		<kanji>お湯が沸く</kanji>
		<kana>おゆがわく</kana>
		<english>water boils</english>
	</listItem>
	<listItem>
		<kanji>転ぶ</kanji>
		<kana>ころぶ</kana>
		<english>to fall down</english>
	</listItem>
	<listItem>
		<kanji>（～を）壊す</kanji>
		<kana>（～を）こわす</kana>
		<english>to break (something)</english>
	</listItem>
	<listItem>
		<kanji>（～が）咲く</kanji>
		<kana>（～が）さく</kana>
		<english>to bloom</english>
	</listItem>
	<listItem>
		<kanji>（～が）閉まる</kanji>
		<kana>（～が）しまる</kana>
		<english>(something) closes</english>
	</listItem>
	<listItem>
		<kanji>助かる</kanji>
		<kana>たすかる</kana>
		<english>to be saved; to be helped</english>
	</listItem>
	<listItem>
		<kanji>（personにfavorを）頼む</kanji>
		<kana>（personにfavorを）たのむ</kana>
		<english>to ask (a favor)</english>
	</listItem>
	<listItem>
		<kanji>（～が）つく</kanji>
		<kana>（～が）つく</kana>
		<english>(something) turns on</english>
	</listItem>
	<listItem>
		<kanji>（～を）汚す</kanji>
		<kana>（～を）よごす</kana>
		<english>to make (something) dirty</english>
	</listItem>
	<listItem>
		<kanji>（～が）落ちる</kanji>
		<kana>（～が）おちる</kana>
		<english>(something) drops</english>
	</listItem>
	<listItem>
		<kanji>（～を）片付ける</kanji>
		<kana>（～を）かたづける</kana>
		<english>to tidy up</english>
	</listItem>
	<listItem>
		<kanji>考える</kanji>
		<kana>かんがえる</kana>
		<english>to think (about); to consider</english>
	</listItem>
	<listItem>
		<kanji>（～が）消える</kanji>
		<kana>（～が）きえる</kana>
		<english>(something) goes off</english>
	</listItem>
	<listItem>
		<kanji>（～が）壊れる</kanji>
		<kana>（～が）こわれる</kana>
		<english>(something) breaks</english>
	</listItem>
	<listItem>
		<kanji>（～が）汚れる</kanji>
		<kana>（～が）よごれる</kana>
		<english>to become dirty</english>
	</listItem>
	<listItem>
		<kanji>（～を）注文する</kanji>
		<kana>（～を）ちゅうもんする</kana>
		<english>to place an order</english>
	</listItem>
	<listItem>
		<kanji>今すぐ</kanji>
		<kana>いますぐ</kana>
		<english>right away</english>
	</listItem>
	<listItem>
		<kanji>（～の）おかげで</kanji>
		<kana>（～の）おかげで</kana>
		<english>thanks to (~)</english>
	</listItem>
	<listItem>
		<kanji>お先に失礼します</kanji>
		<kana>おさきにしつれいします</kana>
		<english>See you. (lit., I'm leaving ahead of you.)</english>
	</listItem>
	<listItem>
		<kanji>お疲れ様（でした）</kanji>
		<kana>おつかれさま（でした）</kana>
		<english>You must be tired after working so hard.  (ritualistic expression)</english>
	</listItem>
	<listItem>
		<kanji>～（ん）だろう</kanji>
		<kana>～（ん）だろう</kana>
		<english>short form of ～（ん）でしょう</english>
	</listItem>
	<listItem>
		<kanji>どうしよう</kanji>
		<kana>どうしよう</kana>
		<english>What should I/we do?</english>
	</listItem>
	<listItem>
		<kanji>本当に</kanji>
		<kana>ほんとうに</kana>
		<english>really</english>
	</listItem>
	<listItem>
		<kanji>まず</kanji>
		<kana>まず</kana>
		<english>first of all</english>
	</listItem>
	<listItem>
		<kanji>（～）までに</kanji>
		<kana>（～）までに</kana>
		<english>by (time/date)</english>
	</listItem>
</kanjiList>
