<?xml version="1.0" encoding="utf-8"?>
<!DOCTYPE kanjiList SYSTEM "kanjiList.dtd">
<kanjiList>
	<name>Book 2, Chapter 14, Lesson 2 Vocabulary</name>
	<listItem>
		<kanji></kanji>
		<kana>なべ</kana>
		<english>pot, pan</english>
	</listItem>
	<listItem>
		<kanji>油</kanji>
		<kana>あぶら</kana>
		<english>oil</english>
	</listItem>
	<listItem>
		<kanji></kanji>
		<kana>うすく</kana>
		<english>thin</english>
	</listItem>
	<listItem>
		<kanji></kanji>
		<kana>あつく</kana>
		<english>thick</english>
	</listItem>
	<listItem>
		<kanji>半分に</kanji>
		<kana>はんぶんに</kana>
		<english>in half</english>
	</listItem>
	<listItem>
		<kanji>切る/切ります</kanji>
		<kana>きる/きります</kana>
		<english>to cut; slice</english>
	</listItem>
	<listItem>
		<kanji>熱く　する</kanji>
		<kana>あつく　する</kana>
		<english>to make hot; to heat</english>
	</listItem>
	<listItem>
		<kanji></kanji>
		<kana>きれいに　する</kana>
		<english>to make clean; to clean</english>
	</listItem>
	<listItem>
		<kanji>まず</kanji>
		<kana>まず</kana>
		<english>first of all</english>
	</listItem>
	<listItem>
		<kanji>初めに</kanji>
		<kana>はじめに</kana>
		<english>at the beginning</english>
	</listItem>
	<listItem>
		<kanji>次に</kanji>
		<kana>つぎに</kana>
		<english>next</english>
	</listItem>
	<listItem>
		<kanji>終わりに</kanji>
		<kana>おわりに</kana>
		<english>at the end</english>
	</listItem>
	<listItem>
		<kanji>フライパン</kanji>
		<kana>フライパン</kana>
		<english>frying pan</english>
	</listItem>
	<listItem>
		<kanji>混ぜます</kanji>
		<kana>まぜます</kana>
		<english>to mix [transitive]</english>
	</listItem>
	<listItem>
		<kanji></kanji>
		<kana>おきます</kana>
		<english>to put; to place</english>
	</listItem>
	<listItem>
		<kanji></kanji>
		<kana>まきます</kana>
		<english>to roll</english>
	</listItem>
	<listItem>
		<kanji></kanji>
		<kana>おします</kana>
		<english>to push; to press</english>
	</listItem>
	<listItem>
		<kanji></kanji>
		<kana>ふっとうします</kana>
		<english>to boil</english>
	</listItem>
	<listItem>
		<kanji>その　あとで</kanji>
		<kana>その　あとで</kana>
		<english>after that</english>
	</listItem>
	<listItem>
		<kanji>その　間</kanji>
		<kana>その　あいだ</kana>
		<english>meanwhile</english>
	</listItem>
</kanjiList>
