<?xml version="1.0" encoding="utf-8"?>
<!DOCTYPE kanjiList SYSTEM "kanjiList.dtd">
<kanjiList>
	<name>Book 2, Chapter 14, Lesson 1 Vocabulary</name>
	<listItem>
		<kanji>作り方</kanji>
		<kana>つくりかた</kana>
		<english>how to make</english>
	</listItem>
	<listItem>
		<kanji>すき焼き</kanji>
		<kana>すきやき</kana>
		<english>&lt;i&gt;sukiyaki&lt;/i&gt;</english>
	</listItem>
	<listItem>
		<kanji>牛肉</kanji>
		<kana>ぎゅうにく</kana>
		<english>beef</english>
	</listItem>
	<listItem>
		<kanji>豚肉</kanji>
		<kana>ぶたにく</kana>
		<english>pork</english>
	</listItem>
	<listItem>
		<kanji>鳥肉</kanji>
		<kana>とりにく</kana>
		<english>chicken (meat)</english>
	</listItem>
	<listItem>
		<kanji>卵</kanji>
		<kana>たまご</kana>
		<english>egg</english>
	</listItem>
	<listItem>
		<kanji>野菜</kanji>
		<kana>やさい</kana>
		<english>vegetable</english>
	</listItem>
	<listItem>
		<kanji>果物</kanji>
		<kana>くだもの</kana>
		<english>fruit</english>
	</listItem>
	<listItem>
		<kanji>苺</kanji>
		<kana>いちご</kana>
		<english>strawberry</english>
	</listItem>
	<listItem>
		<kanji>糸こんにゃく</kanji>
		<kana>いとこんにゃく</kana>
		<english>shredded &lt;i&gt;konnyaku&lt;/i&gt;</english>
	</listItem>
	<listItem>
		<kanji>台所</kanji>
		<kana>だいどころ</kana>
		<english>kitchen</english>
	</listItem>
	<listItem>
		<kanji>材料</kanji>
		<kana>ざいりょう</kana>
		<english>ingredients</english>
	</listItem>
	<listItem>
		<kanji>カップ</kanji>
		<kana>カップ</kana>
		<english>cup (measurement)</english>
	</listItem>
	<listItem>
		<kanji>大サジ</kanji>
		<kana>おおサジ</kana>
		<english>tablespoon</english>
	</listItem>
	<listItem>
		<kanji>小サジ</kanji>
		<kana>こサジ</kana>
		<english>teaspoon</english>
	</listItem>
	<listItem>
		<kanji>二分の一</kanji>
		<kana>にぶんのいち</kana>
		<english>one half (1/2)</english>
	</listItem>
	<listItem>
		<kanji>トマト</kanji>
		<kana>トマト</kana>
		<english>tomato</english>
	</listItem>
	<listItem>
		<kanji>じゃがいも</kanji>
		<kana>じゃがいも</kana>
		<english>potato</english>
	</listItem>
	<listItem>
		<kanji>にんじん</kanji>
		<kana>にんじん</kana>
		<english>carrots</english>
	</listItem>
	<listItem>
		<kanji>たまねぎ</kanji>
		<kana>たまねぎ</kana>
		<english>round onion</english>
	</listItem>
	<listItem>
		<kanji>きゅうり</kanji>
		<kana>きゅうり</kana>
		<english>cucumber</english>
	</listItem>
	<listItem>
		<kanji>なす</kanji>
		<kana>なす</kana>
		<english>eggplant</english>
	</listItem>
	<listItem>
		<kanji>キャベツ</kanji>
		<kana>キャベツ</kana>
		<english>cabbage</english>
	</listItem>
	<listItem>
		<kanji>レタス</kanji>
		<kana>レタス</kana>
		<english>lettuce</english>
	</listItem>
	<listItem>
		<kanji>セロリ</kanji>
		<kana>セロリ</kana>
		<english>celery</english>
	</listItem>
	<listItem>
		<kanji>ピーマン</kanji>
		<kana>ピーマン</kana>
		<english>green pepper</english>
	</listItem>
	<listItem>
		<kanji>はす</kanji>
		<kana>はす</kana>
		<english>lotus root</english>
	</listItem>
	<listItem>
		<kanji>ねぎ</kanji>
		<kana>ねぎ</kana>
		<english>green onion</english>
	</listItem>
	<listItem>
		<kanji>ほうれんそう</kanji>
		<kana>ほうれんそう</kana>
		<english>spinich</english>
	</listItem>
	<listItem>
		<kanji>まめ</kanji>
		<kana>まめ</kana>
		<english>peas; beans</english>
	</listItem>
	<listItem>
		<kanji>だいこん</kanji>
		<kana>だいこん</kana>
		<english>turnip</english>
	</listItem>
	<listItem>
		<kanji>ごぼう</kanji>
		<kana>ごぼう</kana>
		<english>burdock</english>
	</listItem>
	<listItem>
		<kanji>りんご</kanji>
		<kana>りんご</kana>
		<english>apple</english>
	</listItem>
	<listItem>
		<kanji>オレンジ</kanji>
		<kana>オレンジ</kana>
		<english>orange</english>
	</listItem>
	<listItem>
		<kanji>グレープフルーツ</kanji>
		<kana>グレープフルーツ</kana>
		<english>grapefruit</english>
	</listItem>
	<listItem>
		<kanji>みかん</kanji>
		<kana>みかん</kana>
		<english>tangerine</english>
	</listItem>
	<listItem>
		<kanji>（よう）なし</kanji>
		<kana>（よう）なし</kana>
		<english>(Western) pear</english>
	</listItem>
	<listItem>
		<kanji>さくらんぼ</kanji>
		<kana>さくらんぼ</kana>
		<english>cherry</english>
	</listItem>
	<listItem>
		<kanji>すいか</kanji>
		<kana>すいか</kana>
		<english>watermelon</english>
	</listItem>
	<listItem>
		<kanji>バナナ</kanji>
		<kana>バナナ</kana>
		<english>banana</english>
	</listItem>
	<listItem>
		<kanji>パイナップル</kanji>
		<kana>パイナップル</kana>
		<english>pineapple</english>
	</listItem>
	<listItem>
		<kanji>桃</kanji>
		<kana>もも</kana>
		<english>peach</english>
	</listItem>
	<listItem>
		<kanji>ぶどう</kanji>
		<kana>ぶどう</kana>
		<english>grapes</english>
	</listItem>
	<listItem>
		<kanji>メロン</kanji>
		<kana>メロン</kana>
		<english>melon</english>
	</listItem>
	<listItem>
		<kanji>かき</kanji>
		<kana>かき</kana>
		<english>persimmon</english>
	</listItem>
</kanjiList>
